mid,title,rating,ranking,type,genre,rdate,language,cover,description,trailer,released,year
0387764,Peep Show,8.6,126,tv series,"[""Comedy""]",2003-2015,"[""English""]",https://m.media-amazon.com/images/M/MV5BZjYwMWJhOWMtZTc5ZC00MGY0LTg0ZjktMzFhODhhZGZhNDRjXkEyXkFqcGdeQXVyNTA4NzY1MzY@.jpg,Mark and Jez are a couple of twenty-something roommates who have nothing in common - except for the fact that their lives are anything but normal. Mayhem ensues as the pair strive to cope with day-to-day life.,Null,TRUE,2003
0758745,Friday Night Lights,8.6,127,tv series,"[""Drama"", ""Sport""]",2006-2011,"[""English""]",https://m.media-amazon.com/images/M/MV5BYTkxZDVhZGItZjM3Yi00YTU1LTk2ZDYtYTI4NTg2Mjc0NWY1XkEyXkFqcGdeQXVyNTA4NzY1MzY@.jpg,"A drama that follows the lives of the Dillon Panthers, one of the nation's best high school football teams, and their head coach Eric Taylor.",Null,TRUE,2006
5290382,Mindhunter,8.6,128,tv series,"[""Crime"", ""Drama"", ""Thriller""]",2017-2019,"[""English""]",https://m.media-amazon.com/images/M/MV5BNWNmYzQ1ZWUtYTQ3ZS00Y2UwLTlkMDctZThlOTJkMGJiNzBiXkEyXkFqcGdeQXVyNjg2NjQwMDQ@.jpg,"Set in the late 1970s, two FBI agents are tasked with interviewing serial killers to solve open cases.",Null,TRUE,2017
2049116,Gomorrah,8.7,129,tv series,"[""Crime"", ""Drama"", ""Thriller""]",2014-2021,"[""Italian"", ""Neapolitan""]",https://m.media-amazon.com/images/M/MV5BMTgzNmNjZGQtMjM3ZC00Y2Y2LTlkZGItM2EwNTM2MmUyMDExXkEyXkFqcGdeQXVyMTMxNjUyMDkx.jpg,Ciro disregards tradition in his attempt to become the next boss of his crime syndicate. The internal power struggle puts him and his entire family's life at risk.,https://www.youtube.com/watch?v=egtdYTuRKto,TRUE,2014
10530900,Gullak,9.1,130,tv series,"[""Comedy"", ""Drama"", ""Family""]",2019-,"[""Hindi""]",https://m.media-amazon.com/images/M/MV5BMmRjOTBjMGEtMGFmZi00MDc0LTgwNzMtNjMzZTUyM2M4ZTY1XkEyXkFqcGdeQXVyNDY4NjAxNTc@.jpg,"Set in quaint by-lanes in the heart of India, Gullak is a collection of disarming and relatable tales of the Mishra family.",Null,TRUE,2019
12343534,Jujutsu Kaisen,8.7,131,tv series,"[""Animation"", ""Action"", ""Adventure"", ""Fantasy"", ""Thriller""]",2020-,"[""Japanese""]",https://m.media-amazon.com/images/M/MV5BNzQyYzU3Y2MtOWY2Yy00ZGM2LTg3ZTUtMDJkZTJiMmEzMjYxXkEyXkFqcGdeQXVyMTI2NTY3NDg5.jpg,A boy swallows a cursed talisman - the finger of a demon - and becomes cursed himself. He enters a shaman's school to be able to locate the demon's other body parts and thus exorcise himself.,Null,TRUE,2020
0475784,Westworld,8.6,132,tv series,"[""Drama"", ""Mystery"", ""Sci-Fi""]",2016-,"[""English""]",https://m.media-amazon.com/images/M/MV5BMTRmYzNmOTctZjMwOS00ODZlLWJiZGQtNDg5NDY5NjE3MTczXkEyXkFqcGdeQXVyMDM2NDM2MQ@@.jpg,"Set at the intersection of the near future and the reimagined past, explore a world in which every human appetite can be indulged without consequence.",Null,TRUE,2016
0434706,Monster,8.6,133,tv series,"[""Animation"", ""Crime"", ""Drama"", ""Mystery"", ""Thriller""]",2004-2010,"[""English"", ""Japanese""]",https://m.media-amazon.com/images/M/MV5BMzZkOGE4OTItM2RlZi00ZGM5LTlhMDAtZWQxOTlhYTM5NmZkXkEyXkFqcGdeQXVyMTI2OTMwNDcw.jpg,A brilliant neurosurgeon finds his life in utter turmoil after getting involved with a psychopathic former patient.,https://www.youtube.com/watch?v=hA-lmaz4AM8,TRUE,2004
0314979,Battlestar Galactica,8.6,134,tv series,"[""Action"", ""Adventure"", ""Drama"", ""Sci-Fi""]",2003-2003,"[""English""]",https://m.media-amazon.com/images/M/MV5BZjJlYzgzOWUtZmJlZi00ZGM4LTliNzctNWFkNThlMDJhZDQxXkEyXkFqcGdeQXVyNTA4NzY1MzY@.jpg,"Following the destruction of the Twelve Colonies of Kobol by the Cylons, a rag-tag fugitive fleet of the last remnants of mankind flees the pursuing Cylons while simultaneously searching for their true home: Earth.",Null,TRUE,2003
5555260,This Is Us,8.6,135,tv series,"[""Comedy"", ""Drama"", ""Romance""]",2016-2022,"[""English""]",https://m.media-amazon.com/images/M/MV5BYjNlOWY2OWEtMGQyOC00YWQ4LWJkMjUtYzU4NGEzNjM2MWY0XkEyXkFqcGdeQXVyODUxOTU0OTg@.jpg,"A heartwarming and emotional story about a unique set of triplets, their struggles and their wonderful parents.",Null,TRUE,2016
5421602,Anne with an E,8.7,136,tv series,"[""Drama"", ""Family""]",2017-2019,"[""Micmac"", ""French"", ""English""]",https://m.media-amazon.com/images/M/MV5BNThmMzJlNzgtYmY5ZC00MDllLThmZTMtNTRiMjQwNmY0NmRhXkEyXkFqcGdeQXVyMTkxNjUyNQ@@.jpg,"The adventures of a young orphan girl living in the late 19th century. Follow Anne as she learns to navigate her new life on Prince Edward Island, in this new take on L.M. Montgomery's classic novels.",Null,TRUE,2017
6763664,The Haunting of Hill House,8.6,137,tv series,"[""Drama"", ""Horror"", ""Mystery"", ""Thriller""]",2018-2018,"[""English""]",https://m.media-amazon.com/images/M/MV5BMTU4NzA4MDEwNF5BMl5BanBnXkFtZTgwMTQxODYzNjM@.jpg,"Flashing between past and present, a fractured family confronts haunting memories of their old home and the terrifying events that drove them from it.",https://www.youtube.com/watch?v=byjAO1oSzZg,TRUE,2018
0111958,Father Ted,8.6,138,tv series,"[""Comedy""]",1995-1998,"[""English""]",https://m.media-amazon.com/images/M/MV5BYzI2YzQ5MWMtZGU0OC00ZDZkLWFiMGQtMWQzNmQ2Y2E3NDUyXkEyXkFqcGdeQXVyNDIzMzcwNjc@.jpg,"Three misfit priests and their housekeeper live on Craggy Island, not the peaceful and quiet part of Ireland that it seems to be.",Null,TRUE,1995
0773262,Dexter,8.6,139,tv series,"[""Crime"", ""Drama"", ""Mystery"", ""Thriller""]",2006-2013,"[""English"", ""Spanish""]",https://m.media-amazon.com/images/M/MV5BZjkzMmU5MjMtODllZS00OTA5LTk2ZTEtNjdhYjZhMDA5ZTRhXkEyXkFqcGdeQXVyOTA3MTMyOTk@.jpg,"He's smart. He's lovable. He's Dexter Morgan, America's favorite serial killer, who spends his days solving crimes and nights committing them. Golden Globe winner Michael C. Hall stars in the hit SHOWTIME Original Series.",Null,TRUE,2006
0092324,Blackadder the Third,8.6,140,tv series,"[""Comedy""]",1987-1987,"[""English""]",https://m.media-amazon.com/images/M/MV5BMGViZTgzNjEtZWQ3My00YjJkLTk2OGUtZDQ1ODg2ZGEyNzhhXkEyXkFqcGdeQXVyNTA4NzY1MzY@.jpg,"In the Regency era, Mr E. Blackadder serves as butler to the foppish numskull Prince George amidst the fads and crazes of the time.",Null,TRUE,1987
0053488,The Bugs Bunny Show,8.6,141,tv series,"[""Animation"", ""Comedy""]",1960-1975,"[""English""]",https://m.media-amazon.com/images/M/MV5BMzczMzM3M2EtY2E1MS00ZjA2LTg0ZjctOWNjZWMxN2NkYzFkXkEyXkFqcGdeQXVyMTA0MTM5NjI2.jpg,TV series featuring the classic Looney Tunes animated shorts.,Null,TRUE,1960
9174558,Dopesick,8.8,142,tv series,"[""Drama""]",2021-2021,"[""English""]",https://m.media-amazon.com/images/M/MV5BZTc5NmU1YWUtMzgxNC00YmVmLTk1MDYtNjlkNjQwZGVjMTIzXkEyXkFqcGdeQXVyMDM2NDM2MQ@@.jpg,"The series takes viewers to the epicenter of America's struggle with opioid addiction, from the boardrooms of Purdue Pharma, to a distressed Virginia mining community, to the hallways of the DEA.",Null,TRUE,2021
3322312,Daredevil,8.6,143,tv series,"[""Action"", ""Crime"", ""Drama"", ""Fantasy"", ""Sci-Fi"", ""Thriller""]",2015-2018,"[""English""]",https://m.media-amazon.com/images/M/MV5BODcwOTg2MDE3NF5BMl5BanBnXkFtZTgwNTUyNTY1NjM@.jpg,"A blind lawyer by day, vigilante by night. Matt Murdock fights the crime of New York as Daredevil.",https://www.youtube.com/watch?v=ntY1tSIa-Sk,TRUE,2015
1486217,Archer,8.6,144,tv series,"[""Animation"", ""Action"", ""Comedy""]",2009-,"[""English""]",https://m.media-amazon.com/images/M/MV5BMTg3NTMwMzY2OF5BMl5BanBnXkFtZTgwMDcxMjQ0NDE@.jpg,Covert black ops and espionage take a back seat to zany personalities and relationships between secret agents and drones.,https://www.youtube.com/watch?v=pXSJKllkuk4,TRUE,2009
10048342,The Queen's Gambit,8.6,145,tv series,"[""Drama""]",2020-2020,"[""English"", ""French"", ""Spanish"", ""Russian""]",https://m.media-amazon.com/images/M/MV5BM2EwMmRhMmUtMzBmMS00ZDQ3LTg4OGEtNjlkODk3ZTMxMmJlXkEyXkFqcGdeQXVyMjM5ODk1NDU@.jpg,"Orphaned at the tender age of nine, prodigious introvert Beth Harmon discovers and masters the game of chess in 1960s USA. But child stardom comes at a price.",Null,TRUE,2020
12004706,Panchayat,8.8,146,tv series,"[""Comedy"", ""Drama""]",2020-,"[""Hindi""]",https://m.media-amazon.com/images/M/MV5BMTllYzQ0MzctZTI4Ny00YTE2LTkzYjktMTc4ZWE2MDUxNzk2XkEyXkFqcGdeQXVyNzEyNTM4MTU@.jpg,"A comedy-drama, which captures the journey of an engineering graduate Abhishek, who for lack of a better job option joins as secretary of a Panchayat office in a remote village of Uttar Pradesh.",Null,TRUE,2020
1870479,The Newsroom,8.6,147,tv series,"[""Drama""]",2012-2014,"[""English""]",https://m.media-amazon.com/images/M/MV5BZDI0OWIwMTgtZGIyOC00ODRhLWIwNjAtOWViZmMwOWYwOGViXkEyXkFqcGdeQXVyNTE1NjY5Mg@@.jpg,"A newsroom undergoes some changes in its workings and morals as a new team is brought in, bringing unexpected results for its existing news anchor.",Null,TRUE,2012
10850932,Crash Landing on You,8.7,148,tv series,"[""Adventure"", ""Comedy"", ""Romance""]",2019-2020,"[""Korean""]",https://m.media-amazon.com/images/M/MV5BMzRiZWUyN2YtNDI4YS00NTg2LTg0OTgtMGI2ZjU4ODQ4Yjk3XkEyXkFqcGdeQXVyNTI5NjIyMw@@.jpg,The absolute top secret love story of a chaebol heiress who made an emergency landing in North Korea because of a paragliding accident and a North Korean special officer who falls in love with her and who is hiding and protecting her.,Null,TRUE,2019
0080306,Yes Minister,8.6,149,tv series,"[""Comedy""]",1980-1984,"[""English""]",https://m.media-amazon.com/images/M/MV5BZjlkOGIyOWUtN2I2My00MzFjLTlhYTQtYmRkZjQ3Nzg1MWY4XkEyXkFqcGdeQXVyNTA4NzY1MzY@.jpg,"The Right Honorable James Hacker has landed the plum job of Cabinet Minister to the Department of Administration. At last he is in a position of power and can carry out some long-needed reforms, or so he thinks.",Null,TRUE,1980
1795096,Behzat Ç.: Bir Ankara Polisiyesi,8.8,150,tv series,"[""Crime"", ""Drama"", ""Mystery"", ""Thriller""]",2010-2019,"[""Turkish""]",https://m.media-amazon.com/images/M/MV5BZDZjY2I5ZjEtZGE2MS00ZjRmLTlmMGEtMDQ5ZmZhZWJjYzk3XkEyXkFqcGdeQXVyNDg4MjkzNDk@.jpg,"Centered around a personally troubled, officially discredited police chief and his inharmonious police team in Ankara Police Force. Even though the show usually focuses on murders and other crimes that happens on a weekly basis, the undertone of the story leads to an eventual duel between Behzat Ç. and the rotten department officials and bureaucrats.::ahmetkozan",Null,TRUE,2010
0203082,Rurouni Kenshin: Trust and Betrayal,8.6,151,tv series,"[""Animation"", ""Action"", ""Adventure"", ""Drama"", ""History""]",1999-1999,"[""Japanese""]",https://m.media-amazon.com/images/M/MV5BM2FiOWE5MjctNWMxMC00ZTE5LWFmMGMtNzVlZjRhZDMzNTFmXkEyXkFqcGdeQXVyNTAyODkwOQ@@.jpg,"In the era of Japan's Meiji Restoration, an assassin regains his humanity.",Null,TRUE,1999
0380136,QI,8.6,152,tv series,"[""Comedy"", ""Game-Show""]",2003-,"[""English""]",https://m.media-amazon.com/images/M/MV5BMjgyYWUxNGMtMGMwZi00OWIyLTkwN2ItOWYyYWUxYzcyNzUwXkEyXkFqcGdeQXVyNjg0NTcxMTg@.jpg,"A comedy panel game in which being Quite Interesting is more important than being right. Sandi Toksvig is joined each week by four comedians to share anecdotes and trivia, and maybe answer some questions as well.",https://www.youtube.com/watch?v=CSquFeBfjlQ,TRUE,2003
8595766,Yeh Meri Family,9.1,153,tv series,"[""Comedy"", ""Drama"", ""Family"", ""Musical"", ""Romance""]",2018-2018,"[""Hindi""]",https://m.media-amazon.com/images/M/MV5BZWMxMjBiZmUtMjM1Yi00ODk4LWE4MjctNmFlYzIzNmE4MmU4XkEyXkFqcGdeQXVyNzEyNTM4MTU@.jpg,Set in the summer of 1998 it is a story about conflicting emotions towards family members from the eyes of a twelve year old.,Null,TRUE,2018
0094525,Poirot,8.6,154,tv series,"[""Crime"", ""Drama"", ""Mystery"", ""Thriller""]",1989-2013,"[""English"", ""French""]",https://m.media-amazon.com/images/M/MV5BODljYzNlZTMtMWIwNi00N2QzLWE2ZTAtZDBmYzIwYzhlZDY2XkEyXkFqcGdeQXVyMjExMjk0ODk@.jpg,"The cases of eccentric, but sharp, Belgian detective Hercule Poirot.",Null,TRUE,1989
1513168,Through the Wormhole,8.6,155,tv series,"[""Documentary""]",2010-2017,"[""English""]",https://m.media-amazon.com/images/M/MV5BMDhkMTY2NGQtMWY4Mi00ZjhmLWIzNGYtZDJhODkwNTM5NTIzXkEyXkFqcGdeQXVyNDk3NDEzMzk@.jpg,"Hosted by Morgan Freeman, Through the Wormhole will explore the deepest mysteries of existence - the questions that have puzzled mankind for eternity. What are we made of? What was there before the beginning? Are we really alone? Is there a creator? These questions have been pondered by the most exquisite minds of the human race. Now, science has evolved to the point where hard facts and evidence may be able to provide us with answers instead of philosophical theories. Through the Wormhole will bring together the brightest minds and best ideas from the very edges of science - Astrophysics, Astrobiology, Quantum Mechanics, String Theory, and more - to reveal the extraordinary truth of our Universe.::Anonymous",Null,TRUE,2010
4236770,Yellowstone,8.7,156,tv series,"[""Drama"", ""Western""]",2018-,"[""English""]",https://m.media-amazon.com/images/M/MV5BZjhkNWM1NTQtODI4NS00NzllLTg1ODAtYjg3N2QxZjc3ZjRiXkEyXkFqcGdeQXVyNDIzMzcwNjc@.jpg,A ranching family in Montana faces off against others encroaching on their land.,Null,TRUE,2018
5189670,Making a Murderer,8.5,157,tv series,"[""Documentary"", ""Crime""]",2015-2018,"[""English""]",https://m.media-amazon.com/images/M/MV5BMTg4Mjc1NjE4Ml5BMl5BanBnXkFtZTgwMjk2NjA1NjM@.jpg,"Filmed over a 10-year period, Steven Avery, a DNA exoneree who, while in the midst of exposing corruption in local law enforcement, finds himself the prime suspect in a grisly new crime.",Null,TRUE,2015
1489428,Justified,8.6,158,tv series,"[""Action"", ""Crime"", ""Drama"", ""Mystery"", ""Thriller"", ""Western""]",2010-2015,"[""English""]",https://m.media-amazon.com/images/M/MV5BMTgzNjQ4NjM1NF5BMl5BanBnXkFtZTcwNzQ4OTEzNw@@.jpg,"U.S. Marshal Raylan Givens is reassigned from Miami to his childhood home in the poor, rural coal mining towns of eastern Kentucky.",Null,TRUE,2010
9544034,The Family Man,8.8,159,tv series,"[""Action"", ""Comedy"", ""Drama""]",2019-,"[""Hindi""]",https://m.media-amazon.com/images/M/MV5BMzRjZWVmMzItNTdmYS00OWEzLTgyOGUtNThiNTU2ZThlYjY0XkEyXkFqcGdeQXVyMTIxMDk2NDE4.jpg,"A working man from the National Investigation Agency tries to protect the nation from terrorism, but he also needs to keep his family safe from his secret job.",Null,TRUE,2019
7221388,Cobra Kai,8.6,160,tv series,"[""Action"", ""Comedy"", ""Drama"", ""Sport""]",2018-,"[""English""]",https://m.media-amazon.com/images/M/MV5BOTE1M2Q3YjQtZGMzYy00MDcwLWIzNzctYzI3MDBhMjBmYTQwXkEyXkFqcGdeQXVyMTEyMjM2NDc2.jpg,"Decades after their 1984 All Valley Karate Tournament bout, a middle-aged Daniel LaRusso and Johnny Lawrence find themselves martial-arts rivals again.",Null,TRUE,2018
0417349,North & South,8.6,161,tv series,"[""Drama"", ""Romance""]",2004-2004,"[""English""]",https://m.media-amazon.com/images/M/MV5BYjU4NGI4MjQtOTJlZC00Y2UxLWFiMDAtODJhZDFmYmVjMTY3XkEyXkFqcGdeQXVyNTE1NjY5Mg@@.jpg,"North and South is a four part adaptation of Elizabeth Gaskell's love story of Margaret Hale, a middle class southerner who is forced to move to the northern town of Milton.",https://en.wikipedia.org/wiki/North,TRUE,2004
2244495,The Eric Andre Show,8.6,162,tv series,"[""Comedy""]",2012-,"[""English""]",https://m.media-amazon.com/images/M/MV5BZWI4YTVhYmMtZmZjNS00MmFjLTkyMDItNzcxYjVjZjZmODliXkEyXkFqcGdeQXVyMzM4NjcxOTc@.jpg,"Eric Andre tries to host a talk show in a bizarre environment, where he is sometimes the player of pranks and sometimes the victim.",Null,TRUE,2012
0187664,Spaced,8.5,163,tv series,"[""Action"", ""Comedy""]",1999-2001,"[""English""]",https://m.media-amazon.com/images/M/MV5BMmNjODUxNzctOWU2Zi00ZGU3LWI2MDEtMjZjNjE2MmJiMDZiXkEyXkFqcGdeQXVyNTA4NzY1MzY@.jpg,"Friends Tim and Daisy, 20-something North Londoners with uncertain futures, must pretend to be a couple to live in the only apartment they can afford.",Null,TRUE,1999
0096657,Mr. Bean,8.5,164,tv series,"[""Comedy"", ""Family""]",1990-1995,"[""English""]",https://m.media-amazon.com/images/M/MV5BOGNjZTRlNDctNGI0Yi00YmFkLTljMmQtMjQ1ZjdiNmU5YTc0XkEyXkFqcGdeQXVyNTA4NzY1MzY@.jpg,"Bumbling, childlike Mr. Bean has trouble completing the simplest of tasks in day-to-day life, but his perseverance and resourcefulness frequently allow him to find ingenious ways around problems.",Null,TRUE,1990
0275137,Justice League,8.5,165,tv series,"[""Animation"", ""Action"", ""Adventure"", ""Drama"", ""Family"", ""Fantasy"", ""Mystery""]",2001-2004,"[""English""]",https://m.media-amazon.com/images/M/MV5BMDE2ODk0ZTctMGI4Ni00ODgwLTk4OTAtOGNiNjZkMzI3NTY0XkEyXkFqcGdeQXVyOTgwMzk1MTA@.jpg,Seven of the most formidable heroes form arguably the most powerful team ever.,https://www.youtube.com/watch?v=3cxixDgHUYw,TRUE,2001
0988824,Naruto: Shippûden,8.6,166,tv series,"[""Animation"", ""Action"", ""Adventure"", ""Comedy"", ""Drama"", ""Fantasy""]",2007-2017,"[""English"", ""Japanese""]",https://m.media-amazon.com/images/M/MV5BMTE5NzIwMGUtYTE1MS00MDUxLTgyZjctOWVkZDAxM2M4ZWQ4XkEyXkFqcGdeQXVyNjc2NjA5MTU@.jpg,"Naruto Uzumaki, is a loud, hyperactive, adolescent ninja who constantly searches for approval and recognition, as well as to become Hokage, who is acknowledged as the leader and strongest of all ninja in the village.",Null,TRUE,2007
7908628,What We Do in the Shadows,8.6,167,tv series,"[""Comedy"", ""Fantasy"", ""Horror""]",2016-,"[""English""]",https://m.media-amazon.com/images/M/MV5BYzZhZWVkNzYtZjZmOS00MTE1LWFkZTQtYzViYWU0MDU3MDIxXkEyXkFqcGdeQXVyMTkxNjUyNQ@@.jpg,"A look into the daily (or rather, nightly) lives of three vampires, who've lived together for over 100 years, on Staten Island.",https://www.youtube.com/watch?v=IAZEWtyhpes,TRUE,2016
0112159,Neon Genesis Evangelion,8.5,168,tv series,"[""Animation"", ""Action"", ""Drama"", ""Fantasy"", ""Sci-Fi"", ""Thriller""]",1995-1996,"[""Japanese""]",https://m.media-amazon.com/images/M/MV5BYjY1Y2ZmNDctZWQ3Yy00MTE3LTk2M2QtMjQ0MDA5ODVjMDEyXkEyXkFqcGdeQXVyNTA4NzY1MzY@.jpg,A teenage boy finds himself recruited as a member of an elite team of pilots by his father.,https://www.youtube.com/watch?v=Q3_PS6xa9Uw,TRUE,1995
0403778,Long Way Round,8.6,169,tv series,"[""Documentary"", ""Adventure""]",2004-,"[""English""]",https://m.media-amazon.com/images/M/MV5BYTAxNWFmMTktMDVjNC00YWFkLTg2NDQtNjQwODZlYmQ2YTA2XkEyXkFqcGdeQXVyNTAyODkwOQ@@.jpg,"This documentary series follows actors Ewan McGregor and Charley Boorman on a motorcycle trip around the world. The two friends will travel through such places as Siberia, Kazakhstan, Mongolia, and Alaska, before finally ending the journey in New York. The filming will be done by on board cameras and one ride along cameraman.::solojones",Null,TRUE,2004
0120570,From the Earth to the Moon,8.6,170,tv series,"[""Action"", ""Drama"", ""History"", ""Thriller""]",1998-1998,"[""English""]",https://m.media-amazon.com/images/M/MV5BMTg1NTM4ODctMWUxYi00NDZhLWJhNGEtNzA3MGE4MWY4N2E2XkEyXkFqcGdeQXVyNTA4NzY1MzY@.jpg,Dramatized portrayal of the Apollo manned space program.,Null,TRUE,1998
0423731,Samurai Champloo,8.5,171,tv series,"[""Animation"", ""Action"", ""Adventure"", ""Comedy"", ""Drama"", ""Thriller""]",2004-2005,"[""Japanese""]",https://m.media-amazon.com/images/M/MV5BOWNhMDMyMDYtNzJlOS00YzhhLWFiMjktYWY1MzMzZGZhOGRjXkEyXkFqcGdeQXVyNDYzNTI2ODc@.jpg,"Fuu, a waitress who works in a teahouse, rescues two master swordsmen, Mugen and Jin, from their execution to help her find the ""samurai who smells of sunflowers.""",Null,TRUE,2004
0979432,Boardwalk Empire,8.5,172,tv series,"[""Crime"", ""Drama"", ""History""]",2010-2014,"[""English""]",https://m.media-amazon.com/images/M/MV5BYTYxNzc5ZmYtODcyNi00ZWUwLWExNWUtY2Y0YTlhZDBlMGU1XkEyXkFqcGdeQXVyNzQ1ODk3MTQ@.jpg,An Atlantic City politician plays both sides of the law by conspiring with gangsters during the Prohibition era.,Null,TRUE,2010
4093826,Twin Peaks,8.5,173,tv series,"[""Crime"", ""Drama"", ""Fantasy"", ""Mystery"", ""Thriller""]",2017-2017,"[""English"", ""French""]",https://m.media-amazon.com/images/M/MV5BMjA5MTkzNTY5Ml5BMl5BanBnXkFtZTgwNjU4MzY1MTI@.jpg,Picks up 25 years after the inhabitants of a quaint northwestern town are stunned when their homecoming queen is murdered.,Null,TRUE,2017
0088509,Dragon Ball,8.5,174,tv series,"[""Animation"", ""Action"", ""Adventure"", ""Comedy"", ""Fantasy"", ""Sci-Fi""]",1986-1989,"[""Japanese""]",https://m.media-amazon.com/images/M/MV5BMjRlYTYyMDUtOGY5MC00MmFiLTljOTMtM2QzOWZjMWViN2FiL2ltYWdlXkEyXkFqcGdeQXVyNTAyODkwOQ@@.jpg,"Son Gokû, a fighter with a monkey tail, goes on a quest with an assortment of odd characters in search of the Dragon Balls, a set of crystals that can give its bearer anything they desire.",https://www.youtube.com/watch?v=bFLt45xK3kU,TRUE,1986
0863046,Flight of the Conchords,8.5,175,tv series,"[""Comedy"", ""Music"", ""Musical""]",2007-2009,"[""English""]",https://m.media-amazon.com/images/M/MV5BNTM4M2VhY2UtZTJmMi00YmFjLTk4OWItMzU2ZDA3NTUxZjYxXkEyXkFqcGdeQXVyNTA4NzY1MzY@.jpg,"Bret and Jemaine are Flight of the Conchords, a folk-rock band from New Zealand living in New York City in search of stardom.",Null,TRUE,2007
7562112,Pose,8.6,176,tv series,"[""Drama""]",2018-2021,"[""English""]",https://m.media-amazon.com/images/M/MV5BMjQ2ZDMzNmMtZWZmZC00MTFjLWFiMTMtNzJjY2Q3ZjQ3MmI0XkEyXkFqcGdeQXVyMTEyMjM2NDc2.jpg,"In the New York of the late 80s and early 90s, this is a story of ball culture and the gay and trans community, the raging AIDS crisis and capitalism.",Null,TRUE,2018
1305826,Adventure Time,8.6,177,tv series,"[""Animation"", ""Action"", ""Adventure"", ""Comedy"", ""Family"", ""Fantasy"", ""Sci-Fi""]",2010-2018,"[""English"", ""Korean""]",https://m.media-amazon.com/images/M/MV5BZGY2ZGFkYjctOWY2Ni00MGQ5LWE4OTItNjJhNzA5MWFmMjk1XkEyXkFqcGdeQXVyNTgyNTA4MjM@.jpg,"A 12-year-old boy and his best friend, wise 28-year-old dog with magical powers, go on a series of surreal adventures with each other in a remote future.",https://www.youtube.com/watch?v=-e_Q154xjts,TRUE,2010
6108262,Black Sun,8.8,178,tv series,"[""Crime"", ""Drama"", ""Thriller""]",2017-,"[""Serbian"", ""Russian"", ""Macedonian"", ""German"", ""Slovenian""]",https://m.media-amazon.com/images/M/MV5BYjAzMzc3OTMtZTAzNi00OWI0LWJmOGEtYjI3MWZmY2IzNDkxXkEyXkFqcGdeQXVyMTk0MjQ3Nzk@.jpg,"A historical fiction drama and thriller set in the turbulent period of the late 1920s in the Balkans as a place where high politics, local interests, capital and crime all merge together.",Null,TRUE,2017
0280249,Dragon Ball,8.5,179,tv series,"[""Animation"", ""Action"", ""Adventure"", ""Fantasy"", ""Sci-Fi"", ""Thriller""]",1995-2003,"[""English"", ""Japanese""]",https://m.media-amazon.com/images/M/MV5BNDYyNTJkNmItYjgxNC00ODliLTg2MGMtZjkxNjEwYzdjNjUxXkEyXkFqcGdeQXVyNTA4NzY1MzY@.jpg,"Dragon Ball tells the tale of a young warrior by the name of Son Goku, a young peculiar boy with a tail who embarks on a quest to become stronger and learns of the Dragon Balls, when, once all 7 are gathered, grant any wish of choice.",https://www.youtube.com/watch?v=bFLt45xK3kU,TRUE,1995
5897304,Mob Psycho 100,8.6,180,tv series,"[""Animation"", ""Action"", ""Comedy"", ""Fantasy"", ""Horror""]",2016-,"[""Japanese""]",https://m.media-amazon.com/images/M/MV5BZmE1NjIyNjYtMTVmMy00M2YyLTljMjMtZGQwYmUxOTU4NjRlXkEyXkFqcGdeQXVyNjc3OTE4Nzk@.jpg,"A psychic middle school boy tries to live a normal life and keep his growing powers under control, even though he constantly gets into trouble.",Null,TRUE,2016
0086831,"Yes, Prime Minister",8.6,181,tv series,"[""Comedy""]",1986-1987,"[""English""]",https://m.media-amazon.com/images/M/MV5BZDAyOTQ5YWUtNjNiZS00NmJiLTljNDItMzU2YWNjMjk4MTVjXkEyXkFqcGdeQXVyNTA4NzY1MzY@.jpg,James Hacker was propelled along the corridors of power to the very pinnacle of politics - Number 10.,Null,TRUE,1986
4158110,Mr. Robot,8.5,182,tv series,"[""Crime"", ""Drama"", ""Thriller""]",2015-2019,"[""English"", ""Swedish"", ""Danish"", ""Chinese"", ""Persian"", ""Spanish"", ""Samoan"", ""Arabic"", ""German""]",https://m.media-amazon.com/images/M/MV5BMzgxMmQxZjQtNDdmMC00MjRlLTk1MDEtZDcwNTdmOTg0YzA2XkEyXkFqcGdeQXVyMzQ2MDI5NjU@.jpg,"Elliot, a brilliant but highly unstable young cyber-security engineer and vigilante hacker, becomes a key figure in a complex game of global dominance when he and his shadowy allies try to take down the corrupt corporation he works for.",Null,TRUE,2015
0487831,The IT Crowd,8.5,183,tv series,"[""Comedy""]",2006-2013,"[""English""]",https://m.media-amazon.com/images/M/MV5BMjE5MThjMzAtNWVmNC00YThkLTlmNzktMTM3Yzk4YTZhMTgwXkEyXkFqcGdeQXVyNTAyODkwOQ@@.jpg,"The comedic misadventures of Roy, Moss and their grifting supervisor Jen, a rag-tag team of IT support workers at a large corporation headed by a hotheaded yuppie.",Null,TRUE,2006
0094517,Mystery Science Theater 3000,8.5,184,tv series,"[""Comedy"", ""Sci-Fi""]",1988-1999,"[""English""]",https://m.media-amazon.com/images/M/MV5BMTc4Nzc0Mzc5M15BMl5BanBnXkFtZTcwMDYzNTYyMQ@@.jpg,"In the not-too-distant future Joel Robinson is held captive by Dr. Forrester and TV's Frank, forced to watch B-Grade movies on the Satellite of Love with the help of his robot friends: Cambot, Gypsy, Tom Servo and Crow T. Robot.",https://www.youtube.com/watch?v=IY3shxrxelI,TRUE,1988
0047708,Alfred Hitchcock Presents,8.5,185,tv series,"[""Comedy"", ""Crime"", ""Drama"", ""Horror"", ""Mystery"", ""Thriller""]",1955-1962,"[""English""]",https://m.media-amazon.com/images/M/MV5BOWQ1OGI0ZTItOTNkYi00NWFhLWE3ZWYtODVmMjkzMmM1NDYwXkEyXkFqcGdeQXVyNTA4NzY1MzY@.jpg,"Series of unrelated short stories covering elements of crime, horror, drama, and comedy about people of different backgrounds committing murders, suicides, thefts, and other sorts of crime caused by certain motivations, perceived or not.",Null,TRUE,1955
